id,desc,_2020,_2021,_2022,_2023,_2024,_2025
6421000,Einzahlungen aus dem Verkauf von beweglichen Sachen,30.000000,200.000000,200.000000,200.000000,200.000000,200.000000
6422200,Einzahlungen aus dem Verkauf von geringwertigen Vermögensgegenständen,5.000000,100.000000,0.000000,0.000000,0.000000,0.000000
6461000,Sonstige privatrechtliche Leistungsentgelte,465.170000,500.000000,500.000000,500.000000,500.000000,500.000000
6484000,Einzahlungen aus Kostenerstattungen von gesetzlichen Sozialversicherungen,10957.520000,0.000000,0.000000,0.000000,0.000000,0.000000
6485000,Einzahl. aus Kostenerstattungen von verbund. Untern.,2000.000000,0.000000,0.000000,0.000000,0.000000,0.000000
6488000,Einzahlungen aus Kostenerstattungen von übrigen Bereichen,8038.520000,2500.000000,0.000000,0.000000,0.000000,0.000000
