id;desc;_2020;_2021;_2022;_2023;_2024;_2025
7011000;Dienstauszahlungen und dgl. an Beamte;112241.320000;113800.000000;117100.000000;118200.000000;120600.000000;123100.000000
7012000;Dienstauszahlungen und dgl. an Arbeitnehmer;375804.900000;356900.000000;268700.000000;274000.000000;279600.000000;285300.000000
7021000;Beiträge zu Versorgungskassen für Beamte;80008.300000;81200.000000;87800.000000;84400.000000;86100.000000;87900.000000
7022000;Beiträge zu Versorgungskassen für Arbeitnehmer;15057.380000;15000.000000;11200.000000;11500.000000;11800.000000;12100.000000
7032000;Beiträge zur gesetzlichen Sozialver.aus DienstAusz und dgl. für Arbeitnehmer;70713.230000;70100.000000;54000.000000;55200.000000;56300.000000;57500.000000
7041000;Beihilfen, Unterstützungsleistungen für Beschäftigte;1630.210000;2000.000000;1700.000000;1800.000000;1900.000000;2000.000000
